{
  "title": "Example Monitor",
  "message": "CPU usage is high on {{host.name}}",
  "timestamp": "2026-04-17T12:00:00Z",
  "priority": "normal",
  "host": "example_value",
  "tags": [
    "env:production"
  ],
  "alert_type": "error",
  "aggregation_key": "example_value",
  "source_type_name": "Example Monitor",
  "status": "OK"
}